Week,Date,Post_Type,Topic,Content_Hook,Main_Message,CTA,Target_Audience,Hashtags,Expected_Engagement
1,2025-01-06,Company Intro,Technology Launch,"🚀 Introducing Luminous BioSolutions","We're revolutionizing environmental monitoring with real-time naphthenic acid detection in oil sands tailings. Our biosensor technology provides instant results where traditional methods take weeks.","Learn more about our technology →",Multi-Audience,"#EnvironmentalMonitoring #OilSands #Biosensor #CleanTech #Innovation",75 reactions
1,2025-01-08,Educational,Industry Problem,"⚠️ The hidden cost of delayed environmental data","When environmental monitoring results take 2-3 weeks to process, contamination events can escalate exponentially. Here's why real-time data isn't just better—it's essential for protection.","Download our industry report →",Industry,"#EnvironmentalData #RealTimeMonitoring #Compliance #RiskManagement",60 reactions
1,2025-01-10,Behind-the-Scenes,Technology Demo,"🔬 Inside our lab: Where innovation meets precision","Take a look at our biosensor technology in action. From sample collection to data visualization in under 15 minutes—this is the future of environmental monitoring.","See full demo video →",Technical/Academic,"#Innovation #BiosensorTech #LabLife #Technology #Research",90 reactions
2,2025-01-13,Industry Insight,Market Trends,"📊 2025 Predictions: Environmental monitoring evolution","The environmental monitoring industry is experiencing a paradigm shift. Real-time data, AI integration, and predictive analytics are becoming the new standard. Here's what this means for oil sands operations.","Read our full analysis →",Industry,"#Trends2025 #EnvironmentalTech #OilSands #DataAnalytics #PredictiveMonitoring",85 reactions
2,2025-01-15,Educational Thread,Technical Deep-dive,"🧵 Thread: The science behind naphthenic acid detection [1/7]","Naphthenic acids are complex organic compounds that pose significant environmental challenges in oil sands operations. Here's how our biosensor technology achieves 99.7% detection accuracy...","Read the complete thread →",Academic/Technical,"#NaphthenicAcids #BiosensorScience #EnvironmentalChemistry #Research #OilSands",120 reactions
2,2025-01-17,Case Study,Success Story,"✅ Case Study: 70% cost reduction in monitoring operations","A major oil sands operator reduced their environmental monitoring costs by 70% while improving data quality and response times. Here's how real-time biosensor technology transformed their operations.","Download case study →",Industry,"#CaseStudy #CostReduction #ROI #EnvironmentalMonitoring #Success",95 reactions
3,2025-01-20,Thought Leadership,Regulatory Landscape,"🏛️ Regulatory evolution in environmental monitoring","New environmental regulations are driving demand for more frequent, accurate monitoring. Traditional lab-based testing can't keep pace. Here's how real-time monitoring addresses regulatory challenges.","Get compliance guide →",Regulatory,"#Regulation #Compliance #EnvironmentalLaw #Monitoring #GovernmentRelations",70 reactions
3,2025-01-22,Partnership,Collaboration,"🤝 Exciting partnership announcement","Thrilled to announce our research collaboration with [University] to advance biosensor technology for environmental applications. Together, we're pushing the boundaries of what's possible.","Learn about our research →",Academic,"#Partnership #Research #Collaboration #University #Innovation #Academia",65 reactions
3,2025-01-24,Educational,Data Integration,"📈 From sensors to insights: The data platform advantage","Collecting real-time data is just the beginning. Our integrated platform transforms raw sensor data into actionable insights through advanced analytics and machine learning algorithms.","Explore our platform →",Technical,"#DataPlatform #Analytics #MachineLearning #Integration #Insights #Technology",80 reactions
4,2025-01-27,Industry Commentary,Sustainability,"🌱 The sustainability imperative in resource extraction","Environmental stewardship isn't just regulatory compliance—it's competitive advantage. Companies leading in environmental monitoring are positioning themselves for long-term success.","Read sustainability report →",Industry,"#Sustainability #ESG #EnvironmentalStewardship #CompetitiveAdvantage #ResourceExtraction",75 reactions
4,2025-01-29,Behind-the-Scenes,Team Spotlight,"👥 Meet our research team","Behind every breakthrough is a team of dedicated scientists and engineers. Meet the researchers developing the next generation of environmental monitoring technology.","Meet the team →",General,"#TeamSpotlight #Research #Scientists #Innovation #CompanyCulture #Behind TheScenes",55 reactions
4,2025-01-31,Educational,Future Tech,"🔮 The future of environmental monitoring","Imagine continuous, real-time environmental data across entire industrial operations. Predictive contamination alerts. Autonomous response systems. This future is closer than you think.","Explore future tech →",Multi-Audience,"#FutureTech #Innovation #Prediction #EnvironmentalTech #Automation",100 reactions
5,2025-02-03,Research Publication,Scientific Authority,"📄 New research published: Biosensor accuracy validation","Our peer-reviewed research demonstrates 99.7% accuracy in field conditions across diverse environmental matrices. This validates our technology's reliability for critical monitoring applications.","Read the paper →",Academic,"#Research #PeerReviewed #Publication #Science #Validation #Accuracy",85 reactions
5,2025-02-05,Educational Thread,Problem-Solution,"🧵 Thread: Solving the real-time monitoring challenge [1/6]","Traditional environmental monitoring creates dangerous data gaps. By the time lab results arrive, contamination events may have caused irreversible damage. Here's how we solve this...","Read full solution →",Industry,"#ProblemSolving #RealTimeMonitoring #EnvironmentalProtection #DataGaps",90 reactions
5,2025-02-07,Industry Insight,Technology Adoption,"📊 Industry adoption of real-time monitoring accelerating","Forward-thinking companies are embracing real-time environmental monitoring. Early adopters report significant operational improvements and risk reduction. The transformation is underway.","Get adoption guide →",Industry,"#Adoption #Transformation #OperationalExcellence #RiskReduction #IndustryLeadership",70 reactions
6,2025-02-10,Educational,Data Visualization,"📊 Making environmental data actionable","Raw sensor data becomes powerful when properly visualized. Our platform transforms complex environmental datasets into clear, actionable insights for immediate decision-making.","See demo dashboard →",Technical,"#DataVisualization #Dashboard #Insights #DecisionMaking #UserExperience",65 reactions
6,2025-02-12,Thought Leadership,Innovation,"💡 Innovation in environmental technology","True innovation happens at the intersection of urgent need and breakthrough technology. The environmental monitoring industry is experiencing its iPhone moment.","Read innovation story →",Multi-Audience,"#Innovation #Breakthrough #Technology #EnvironmentalTech #Transformation",95 reactions
6,2025-02-14,Case Study,Implementation,"🏗️ Implementation success: From pilot to full deployment","How a major industrial client successfully deployed our monitoring system across multiple sites, achieving 60% faster incident response and 45% reduction in compliance costs.","Download implementation guide →",Industry,"#Implementation #Deployment #Success #ClientSuccess #Pilot #Scale",85 reactions